{
  "id": "ext-500123",
  "name": "Tab Manager Pro",
  "description": "An advanced tab management extension for Microsoft Edge with grouping, search, and session save features.",
  "status": "Published",
  "version": "2.1.0",
  "lastUpdatedUtc": "2026-04-15T10:30:00Z",
  "category": "Productivity"
}
